{"$schema":"https://json-schema.org/draft/2020-12/schema","$id":"https://raw.githubusercontent.com/cyber-sentinel/Cyber-Sentinel-Atlas/main/schemas/ingestion/v1/inventory-definition.schema.json","title":"AuthoritativeInventoryDefinition","type":"object","additionalProperties":false,"required":["ingestion_contract_version","inventory_contract_version","inventory_id","inventory_kind","declared_scope","source_ids","inventory_method","inventory_source_version","digest","expected_identity_count","identity_dimensions","scope_metadata","guardrails"],"properties":{"ingestion_contract_version":{"$ref":"https://raw.githubusercontent.com/cyber-sentinel/Cyber-Sentinel-Atlas/main/schemas/ingestion/v1/defs/common.schema.json#/$defs/contract_version"},"inventory_contract_version":{"$ref":"https://raw.githubusercontent.com/cyber-sentinel/Cyber-Sentinel-Atlas/main/schemas/ingestion/v1/defs/common.schema.json#/$defs/semver"},"inventory_id":{"$ref":"https://raw.githubusercontent.com/cyber-sentinel/Cyber-Sentinel-Atlas/main/schemas/ingestion/v1/defs/common.schema.json#/$defs/artifact_id"},"inventory_kind":{"type":"string","enum":["telemetry","documentation"]},"declared_scope":{"type":"string","minLength":1},"source_ids":{"type":"array","minItems":1,"uniqueItems":true,"items":{"$ref":"https://raw.githubusercontent.com/cyber-sentinel/Cyber-Sentinel-Atlas/main/schemas/ingestion/v1/defs/common.schema.json#/$defs/canonical_id"}},"inventory_method":{"type":"string","enum":["provider-manifest","documentation-index","structured-feed","api","git-tree","manual-controlled"]},"inventory_source_version":{"$ref":"https://raw.githubusercontent.com/cyber-sentinel/Cyber-Sentinel-Atlas/main/schemas/ingestion/v1/defs/common.schema.json#/$defs/source_version"},"digest":{"$ref":"https://raw.githubusercontent.com/cyber-sentinel/Cyber-Sentinel-Atlas/main/schemas/ingestion/v1/defs/common.schema.json#/$defs/sha256_digest"},"expected_identity_count":{"type":"integer","minimum":0},"identity_dimensions":{"type":"array","minItems":1,"uniqueItems":true,"items":{"type":"string","enum":["provider","channel","telemetry-source","native-id","product","platform","applicability","version"]}},"scope_metadata":{"type":"object"},"guardrails":{"type":"object","additionalProperties":false,"required":["max_unexplained_shrink_percent","max_unexplained_growth_percent"],"properties":{"max_unexplained_shrink_percent":{"type":"number","minimum":0,"maximum":100},"max_unexplained_growth_percent":{"type":"number","minimum":0}}}}}
